Text|Rating|Votes|J/N
Chuck Norris can bite into an diamond. Without any teeth.|3.49|39|
The Swine Flu got started because a pig oinked in Chuck Norris's presence. He roundhouse kicked it in the face and it landed on a little mexican boy.|3.49|39|
Chuck Norris never uses question marks. Because Chuck Norris ALWAYS knows the answer.|3.49|37|
Chuck Norris regularly donates his own organs because he can grow them back.|3.49|37|
Chuck Norris can eat unsolved Rubix cubes and poo them out solved.|3.49|100|
Jack be nimble, Jack be quick, but Jack still couldn't withstand a Chuck Norris roundhouse kick.|3.49|95|
Chuck Norris fought The Grim Reaper, Satan, and Evil Santa with one hand and won.|3.49|77|
Chuck Norris dosen't style his hair, it lies perfectly in place out of sheer terror.|3.49|70|
Global warming will end as soon as Chuck Norris puts his shirt back on.|3.49|53|
The Ghostbusters call Chuck Norris.|3.49|45|
TNT was originally developed by Chuck Norris to cure indigestion.|3.49|41|
Chuck Norris makes sure Santa is nice.|3.48|33|
Chuck Norris can put a cooked turkey in the oven and pull out a raw turkey.|3.48|29|
Chuck Norris has his own orbit. Not because he is fat, because everything is forced to revolve around him.|3.48|29|
Chuck Norris can play basketball with a football.|3.48|29|
The reason the Energizer bunny keeps going is because Chuck Norris is chasing it.|3.48|27|
Time flys when Chuck Norris tells it to.|3.48|27|
Chuck Norris doesn't go hunting. He goes killing.|3.48|27|
Australia was a part of Texas until Chuck Norris round house kicked them half way around the world for talking funny.|3.48|27|
Chuck Norris FC'd Through The Fire And Flames on Expert mode with an NES controller.|3.48|25|
The only person to give Chuck Norris a run for his money in a fight was Mr. Rogers in a blood stained sweater.|3.48|25|
Chuck Norris can cut one side of a piece of paper.|3.48|25|
Chuck Norris can walk a tight rope upsidedown.|3.48|25|
Chuck Norris was abducted by aliens, probed them and sent them back to their own planet.|3.48|25|
Chuck Norris feeds his chickens KFC.|3.48|25|
Chuck Norris can make a bb gun automatic.|3.48|23|
The grass is always greener on the other side, if Chuck Norris is there then it's probably just filled with blood and tears.|3.48|23|
Chuck Norris can rip two Intertwined Phone books in half with one hand.|3.48|23|
There were weapons of mass destruction in the Middle East because Chuck Norris was vacationing there at the time.|3.48|23|
Chuck Norris knows where scooby doo is.|3.48|23|
Chuck Norris can cry wolf.|3.48|23|
Chuck Norris can laugh for 10 minutes in a half second.|3.48|23|
Chuck Norris once went to a psychic�to warn her.|3.48|23|
Chuck Norris has found the end of a rainbow and roundhouse kicked the lepricorn.|3.48|21|
Chuck Norris has 5g coverage.|3.48|21|
A UFO tried to abduct Chuck Norris once. When the aliens woke up three hours later, they had no memory of what had happened, but their watches had stopped and their asses were extremely sore...|3.48|21|
Cats are allergic to Chuck Norris.|3.48|21|
Chuck Norris knows how many peppers Peter Piper picked.|3.48|21|
If Chuck Norris slept with your girlfriend it would be the best day of your life.|3.48|21|
Chuck Norris needs to convince the water to touch him when he showers!|3.48|21|
A average human uses 10% of their brain capacity. A genius uses 15%. Chuck Norris uses 101%.|3.48|21|
Some people go swimming with dolphins, Chuck Norris swims with sharks.|3.48|124|
"Some people don't believe in Chuck Norris. Those ""some people"" are now missing."|3.48|62|
The quickest way to a man's heart is with Chuck Norris' shoe.|3.48|61|
Chuck Norris is so hot, he breathes fire to cool off.|3.48|56|
Chuck Norris makes Happiness cry.|3.48|46|
Chuck Norris can be in two places at one time.|3.48|44|
"""The Man"" tried to stick it to Chuck Norris, now ""The Man"" is on the Moon."|3.47|36|
"Chuck Norris uses the geyser ""Old Faithful"" as a drinking fountain."|3.47|36|
Chuck Norris can snowboard uphill.|3.47|36|
Chuck Norris would not be afraid to show his feminine side, if he had one.|3.47|36|
Chuck Norris says there is an I in team.|3.47|34|
Chuck Norris held a lighter to his butt and farted we now know this as the sun.|3.47|32|
Chuck Norris can pump up a basket ball with a straw, with his lips tied behind his back.|3.47|30|
Chuck Norris blows the seeds out of an apple before he eats it.|3.47|30|
Chuck Norris spies on the NSA.|3.47|30|
Chuck Norris completed PAC MAN blindfolded.|3.47|19|
Whenever there is a Nuclear Fallout there are only two things that survive: Cockroaches and Chuck Norris.|3.47|19|
Chuck Norris Changed Olympic Sprinting forever when he told all of the sprinters that he would roundhouse them if they didnt win. Olympic sprinting is no longer based on speed, it is now based on hoow much you believe Chuck Norris.|3.47|19|
People go UFO sighting, outer space aliens go Chuck Norris sighting.|3.47|19|
"Forrest Gump once said: ""Life is like a box of chocolates. Life is also not pissing off Chuck Norris. And that's all I have to say about that!""."|3.47|19|
Chuck Norris and Medusa once met... They stared into each others eyes, next thing you know Chuck has a new statue.|3.47|19|
The universe is expanding to escape Chuck Norris. So far it has shown no results.|3.47|17|
Humpty Dumpty didn't fall off the wall, Chuck Norris pushed him.|3.47|17|
Chuck Norris can talk underwater.|3.47|17|
Chuck Norris was going to be a character in the original Mortal Combat, but was taken out because the only move he had was a Fatality.|3.47|17|
Chuck Norris can make Young Money's bedrock.|3.47|17|
Chuck Norris can build a deadly bomb using a potato, a piece of floss and green food coloring.|3.47|17|
Chuck Norris's car doesn't run on gasoline, it runs on the blood of his victims because there's an endless supply of it.|3.47|15|
Chuck Norris dos not get hit by cars; cars get hit by Chuck Norris.|3.47|15|
Chuck Norris may have shot the Sheriff but he roundhouse kicked the deputy....|3.47|15|
Chuck Norris can make a snake get tangled up in it's own feet.|3.47|15|
Chuck Norris can hear your shadows, as well as dead-lift them!|3.47|15|
Bullies only take money to collect rent for Chuck Norris.|3.47|15|
People say if you go to the moon, you'll see foot prints of past astronuats. When Neil Amstrong went to the moon, he saw a foot print of Chuck Norris.|3.47|15|
15 minutes will save Chuck Norris 20% or more on car insurance.|3.47|15|
You see the ring you have seven days to live, you see Chuck Norris you have seven seconds.|3.47|93|
When you kick chuck Norris in balls his balls will kick you back.|3.47|62|
Neo fought three agents at once and beat them...He then fought one Chuck Norris and died.|3.47|55|
Chuck Norris bleeds acid.|3.47|55|
God wanted to create the world in ten days but Chuck Norris only gave him seven|3.47|53|
Chuck Norris can lick the back of his head.|3.47|53|
Chuck Norris knows the meaning to life. Thats why he can take it away so easily|3.47|47|
On the fifth day God said let there be Chuck Norris.|3.47|43|
Chuck Norris can smash atoms by squeezing his butt cheeks.|3.47|43|
Chuck Norris won an arm wrestling match with both hands tied behind his back.|3.47|43|
Chuck Norris doesn't get old, the world gets younger.|3.46|39|
Chuck Norris can play Xbox 360 with a PS3 controller.|3.46|39|
Chuck Norris invented ripleys belive it or else.|3.46|35|
Flash floods occur when Chuck Norris pees. Mud slides occur when Chuck Norris... well you get the picture.|3.46|35|
When the Walker, Texas Ranger theme song is played, the Queen of England stands at attention.|3.46|35|
Chuck Norris does his own stunts. When he gets bored he does everyone elses also.|3.46|28|
Chuck Norris has a six pack in his butt.|3.46|28|
Chuck Norris can make the sun blink.|3.46|26|
Before bed Chuck Norris does 900 push-ups and repeadetly punches himself in the face until he falls asleep.|3.46|26|
The reason Pangea split was because Chuck Norris ran out of drinking water.|3.46|26|
Strangely, when ever i have 5 dollars and Chuck Norris has nothing, half a second later Chuck Norris has 5 dollars and i have a severe wound on both sides of my face.|3.46|24|
"The first ten minutes of the movie ""Saving Private Ryan"" was loosley based on a game of dodgeball played by Chuck Norris in the 4th grade."|3.46|24|
Chuck Norris doesn't live life. Life lives Chuck Norris.|3.46|24|
Chuck Norris can eat a soup with a fork and make it stay.|3.46|24|
Chuck Norris doesn't believe in idioms. So when he says that he's killing time, he's literally ending its existence.|3.46|24|
When Chuck Norris was born he slapped the Doctor and caught a taxi home.|3.46|24|
"During the festival ""Running of the Bulls"" in Pamplona, Spain. Chuck Norris walked and the bulls ran."|3.46|24|
Chuck Norris can walk through walls because whenever he gets near the walls break in fear of Chuck Norris roundhouse kicking them.|3.46|13|
Chuck Norris built a better mousetrap, but the world was too frightened to beat a path to his door.|3.46|13|
Chuck Norris is the reason cicadas come out only once every 17 years.|3.46|13|
Chuck Norris can maul a Tiger.|3.46|13|
Cups were invented when Chuck Norris decided to round-house kick a plate.|3.46|13|
You don't dream about Chuck Norris, he enters your dreams as he pleases.|3.46|13|
Chuck Norris doesnt dream, he has simulations.|3.46|13|
Chuck Norris graduated from school with a degree in Chuck Norris.|3.46|115|
If this was a joke then Chuck Norris would be the punch line.|3.46|98|
Chuck Norris is the reason London Bridge is falling down.|3.46|61|
Chuck Norris doesn't save the day, he saves the year.|3.46|57|
Chuck Norris got his drivers license at the age of 16. Seconds.|3.46|54|
On his birthday, Chuck Norris randomly selects one lucky child to be thrown into the sun.|3.45|185|
Chuck Norris doesn't have to lick a tootsie pop to get to the center.|3.45|33|
"When Chuck Norris asks the ""Magic 8-ball"" a question, it always answers; ""Outlook is....whatever you want it to be Mr. Norris""."|3.45|33|
McGruff took a bite outta crime, Chuck Norris took a bite outta McGruff.|3.45|33|
The leading causes of death in the United States are: 1. Heart Disease 2. Chuck Norris 3. Cancer.|3.45|33|
Chuck Norris can un-mash potatoes.|3.45|33|
Chuck Norris found the beef.|3.45|33|
The Nile River Runs Backwards because Chuck Norris told it too.|3.45|29|
Chuck Norris eats babies and poops Delta Force team members.|3.45|29|
Chuck doens't stare at the sun because he wil go blnd, he does it so it won't blow up.|3.45|29|
Chuck Norris doesn't talk in his sleep, he plots.|3.45|29|
When Chuck Norris goes to Vegas the house always loses.|3.45|29|
Chuck Norris can't get shot because no bullet is brave enough to go in the direction of Chuck Norris.|3.45|29|
Chuck Norris was once caught up in a stampede, and now the Woolly Mammoth is extinct.|3.45|29|
"Chuck Norris founded the show "" a thousand ways to die""."|3.45|29|
Chuck Norris can erase Permenant Marker with his pencil's eraser.|3.45|22|
In Lord of the Rings, they orginally had Chuck Norris take the role of Frodo. But Chuck Norris just crushed the ring in his hand then ate it... It would have made for a boring movie.|3.45|22|
Ninjas aren't paid to kill Chuck Norris, Chuck Norris kills ninjas for free.|3.45|22|
A man once said guns were the best way to kill a person. Chuck Norris quickly ended that theory by roundhouse kicking him in the face.|3.45|22|
Chuck Norris can ride over you with a parked car.|3.45|22|
Chuck Norris calculated the Formula 1.|3.45|22|
Chuck Norris only has a night light because the dark is afraid of Chuck Norris.|3.45|20|
Chuck Norris once roundhouse kicked a martian in the face for trying to invade his space.|3.45|20|
Chuck Norris beat Ray Charles and Stevie Wonder in a staring contest at the same time.|3.45|20|
Chuck Norris can defeat the power packed taste of Sunny D.|3.45|20|
Have you ever seen a Chuck Norris blooper? I did'nt think so.|3.45|20|
People invented the automobile to get away from Chuck Norris. Not to be outdone, Chuck Norris invented the automobile accident.|3.45|11|
Chuck Norris can bet against the Harlem Globetrotters and win.|3.45|11|
It has been confirmed that eating pop rocks and soda together will cause an explosion in your belly. Chuck Norris tested it, twice.|3.45|11|
Chuck Norris doesn't eat LIKE a horse. He EATS horse.|3.45|11|
Chuck Norris' Bowling Average is 301.|3.45|11|
Chuck Norris flosses with razorwire.|3.45|11|
In soccer, Chuck Norris can score 2 goals in 1 shot.|3.45|11|
The 4 Horsemen of the Apocolypse live in Chuck Norris' hand.|3.45|11|
Chuck norris does not swim.The waters so afraid that it just goes around him.|3.45|101|
Our founding fathers originally decreed a strict separation between Chuck Norris and state. Chuck Norris eliminated them.|3.45|88|
The surgeon general's warning: Chuck Norris may be hazardous to your health.|3.45|64|
Chuck Norris can squeeze carbon out of diamond.|3.45|58|
Chuck Norris invented time for he needed something to out last him.|3.45|55|
Chuck Norris is the only person who can kick you in the back of your face.|3.45|55|
Chuck and Mr. T walked into a bar. The bar was instntly destroyed, as that level of awesome cannot be contained in one building.|3.45|49|
Chuck Norris goes to Internet without connecting.|3.45|47|
Little kids wear Superman pj's. Superman wears Chuck Norris pj's. Chuck Norris doesnt wear pj's.|3.45|42|
On december 21st 2012 Chuck Norris wakes up on the wrong side of his bed.|3.44|39|
Chuck Norris has never combed his hair...it surrenders everyday.|3.44|36|
Chuck Norris can open a bank account ... with his bare hands!|3.44|36|
Chuck Norris marked the spam button as spam.|3.44|34|
When people want major face surgery they go piss off Chuck Norris.|3.44|34|
One day a man told Chuck that two heads are better then one. So he took that man and another man and roundhouse kicked them together to make the first Siamese twins.|3.44|34|
In world war two, the americans had a decision to either drop the A-bomb, or Chuck Norris on the japanese, they chose the A-bomb because it was more humaine.|3.44|32|
Faster than a locomotive, more powerful than a speeding bullet, able to leap a tall building in a single leap. These are some of Chuck Norris' morning excercises.|3.44|32|
The universe is infinite because Chuck Norris needs room to 'stretch out'.|3.44|32|
Chuck Norris can win a million and 1 DOLLARS on who wants to be a millionaire.|3.44|27|
When Chuck Norris gets thrown in jail, he isn't trapped with other prisoners; the prisoners are trapped in there with him.|3.44|27|
"Terminator told Chuck Norris ""I'll be back"" Chuck Norris is still waiting."|3.44|27|
Cats have Chuck Norris-like reflexes!|3.44|25|
Chuck Norris can run so fast that if he ran around the world, he could see the back of his head.|3.44|25|
"The song ""Wake me up when September ends"" was about a man who got round-house kicked by Chuck Norris in August."|3.44|25|
Chuck Norris once pissed in a man's beer. He is now the most interesting man in the world!|3.44|25|
The chicken came first, but it was so scared of Chuck Norris it went back in the egg.|3.44|18|
One time when out in the Wild West Chuck Norris lost a hair and out came Pecos Bill.|3.44|18|
Instead of doing a crossword puzzle, Chuck Norris solves the Da Vinci Code every morning.|3.44|18|
Chuck Norris overlapped all of his opponents on the 100 meter. 3 times.|3.44|18|
Chuck Norris once roundhouse kicked a cow so hard that 16 individual beef patties came out... already grilled to perfection!!!|3.44|18|
If Chuck Norris�s Car runs out of gas, he squeezes his enemies into fossil fuel...|3.44|18|
Chuck Norris lived with his parents until he was in his forties. I DARE you to have a problem with that.|3.44|18|
Chuck Norris doesn't get his sardines from a can. He gets them from the stomachs of sharks.|3.44|18|
It has been discovered the 7 wonders of the world were actually Chuck Norris' science fair projects.|3.44|18|
Chuck Norris can pee fire.|3.44|18|
Chuck Norris doesn't go to funerals. He doesn't need to confirm his kills.|3.44|18|
Chuck Norris can swim with one finger.|3.44|18|
Chuck Norris turned white beans into black eye peas.|3.44|18|
When you do Chuck Norris a favor...you thank him, because you lived.|3.44|16|
Chuck Norris was at a bar and someone slipped a drug in his drink. That person never made it back home.|3.44|16|
When you have an itch, you scratch yourself, when Chuck Norris has an itch, he shoots himself.|3.44|16|
Chuck Norris is afraid of only one thing. Nothing.|3.44|16|
In Modern warfare there is a mode called search and destroy. Chuck Norris plays that...only in real life.|3.44|16|
Chuck Norris bought a farm just to play Angry Birds.|3.44|16|
"Chuck Norris visits an active volcano every morning to get some of ""the best damn espresso on Earth""."|3.44|9|
Once Popeye the sailer man got into a fight with Chuck Norris. That is how he developed his Speach impediment.|3.44|9|
Chuck Norris can breath in space|3.44|81|
To commit suicide: Some people hang themselves, some people shoot themselves, some people people pick a fight with Chuck Norris.|3.44|72|
Michael Jackson did not get surgery. He got round house kicked by Chuck Norris.|3.44|72|
Arnold Schwarzenegger was casted as the Terminator because Chuck Norris was on vacation|3.44|63|
Chuck Norris can get a tan at night.|3.43|30|
There was a time when Chuck Norris was perfecting his super DOUBLE roundhouse kick....but unfortunetly the government wouldn't allow it to be unleased because when he tryed it on his assistent he killed him...TWICE.|3.43|28|
Chuck Norris can see more colours than you can.|3.43|28|
When Chuck Norris's computer crashes, Bill Gates attempts suicide.|3.43|28|
Each of Chuck Norris' balls is bigger than the other.|3.43|28|
The Berlin Wall fell because Chuck Norris urinated on it.|3.43|23|
The reason why bigfoot, Loch Ness monster, Chupacabra, and Osama Bin Laden are hiding is because they owe Chuck Norris a dime.|3.43|21|
Chuck Norris bit a bat one time and gave it rabies.|3.43|21|
If Chuck Norris gets pulled over, the cops must ask him first.|3.43|21|
Some people can do push-ups with one hand. Chuck Norris can do push-ups without hands but by using wind power from his mouth.|3.43|14|
Chuck Norris can drink beer with his nose. Using a straw.|3.43|14|
Smoking cigarettes makes Chuck Norris more resistant to cancer.|3.43|14|
Chuck Norris doesnt fight, he gives you a reason to hurt yourself.|3.43|14|
Chuck Norris is always first in the lunch queue.|3.43|14|
Chuck Norris takes sleeping pills while driving and operating machinery.|3.43|14|
Chuck Norris DOES know how many licks it takes to get to the tootsie center of a tootsie pop.|3.43|14|
Chuck Norris can go out in a blaze of glory, and come right back in again. He'll roundhouse kick his way back in if he needs to.|3.43|7|
If you traveling through space on a beam of light you still couldn't run away from Chuck Norris.|3.43|107|
Chuck's Norris's Jacket size says 38-special.|3.43|101|
Chuck Norris named his daughter Mercy. The day she was born was the only day Chuck Norris ever had Mercy.|3.43|97|
Chuck Norris caught 'em all.|3.43|81|
The movie, Anacondas, was filmed in Chuck Norris' pants.|3.43|77|
When Chuck Norris slaps a mosquito the blood goes back into the people it bit.|3.43|65|
When you stab Chuck Norris, Blood comes out of your body.|3.43|47|
Chuck Norris CAN teach an old dog new tricks.|3.43|46|
It's safer to tickle a grizzly bear in the ass with a short stick than mess with Chuck Norris.|3.42|36|
There is only one person who survived a roundhous kick from Chuck Norris and look how fu**ed up Stephen Hawkins is.|3.42|33|
Chuck Norris can open a pickle jar on the first try.|3.42|33|
Chuck Norris stared Michael Jackson strait in the eyes: Thats how MJ got white.|3.42|31|
The anagram of WALKER TEXAS RANGER is KARATE WRANGLER SEX. I don't know what that is, but it sounds awesome.|3.42|26|
There are no explosions, just Chuck Norris's farts covered in a sheet of metal.|3.42|26|
If Chuck Norris had been in 'Jaws' it would have been called 'Dentures'.|3.42|26|
Chuck Norris cuts his steak with a spoon.|3.42|26|
Chuck Norris got the sixth golden ticket.|3.42|26|
James Hetfield sleeps with one eye open... because of Chuck Norris.|3.42|24|
We don't have the right to freedom in America, Chuck allows it.... for now.|3.42|24|
"When taking the SAT, write ""Chuck Norris"" for every answer. You will score over 9000."|3.42|24|
Chuck Norris can headbutt himself in the face.|3.42|24|
Chuck Norris plays football by himself. In a tennis court.|3.42|24|
The computor game `Call of Duty` is modelled on a normal working day in Chuck Norris` life.|3.42|24|
THe opening scene in Saving Private Ryan was inspired by games of dgodgebal Chuck Norris played in sixth grade.|3.42|19|
Chuck Norris smiled one time. His beard hides the scars.|3.42|19|
Chuck was once served a raw T-bone steak. He ate the bone and killed the waiter with the meat.|3.42|19|
The day Chuck Norris got thirsty was the day the great lakes disappeared.|3.42|19|
Chuck Norris spits on camels.|3.42|19|
Mr. T makes time for Chuck Norris' jibba-jabba.|3.42|12|
"If you ask Chuck Norris, ""How many fingers am I holding up"", he looks at your toes and gets the right answer."|3.42|12|
All your base are belong to Chuck Norris.|3.42|12|
There is no F1 key on Chuck Norris' keyboard because Chuck Norris never need help.|3.42|12|
Chuck Norris can touch M.C. hammer.|3.42|116|
You can lead a horse to water, but Chuck Norris can make him eat Tequila jello shots.|3.42|96|
Chuck norris didn't hit puberty because if he did...IT WOULD BE DEAD.|3.42|90|
Osama Bin Laden would turn himself in if he found out Chuck Norris was president.|3.42|89|
Everybody loves Raymond. Except Chuck Norris.|3.42|50|
Chuck Norris claps and the night turns to day.|3.42|48|
The reason you don't hear the rooster in the morning any more is because it woke Chuck Norris up one time... enough said.|3.42|45|
Chuck Norris can bend light.|3.41|37|
M&M's melt in Chuck Norris' hand.|3.41|37|
Chuck Norris Didn't act in any of the movie's he was in (except return of the dragon).|3.41|37|
Energy cannot be created or destroyed except by Chuck Norris.|3.41|34|
Chuck Norris actually beat Lance Armstorng in the Tour De France. He was just so far ahead nobody even noticed him.|3.41|32|
Ever wonder how Santa's reindeer were able to fly? The answer's quite simple, they all drank form the stream Chuck Norris peed in.|3.41|32|
The only time Chuck Norris made a mistake is when he thought he made a mistake.|3.41|32|
Chuck Norris ate a bottle of hot sauce and farted. Thats why we have global warming.|3.41|29|
Banana peels slip on Chuck Norris.|3.41|29|
Chuck Norris visited Iraq in 2003. This was all the evidence George Bush needed to invade Iraq for harboring weapons of mass destruction.|3.41|29|
During his own birth Chuck Norris taught his Mom Lamaze Breathing.|3.41|29|
Chuck Norris doesn't fail tests. Tests fail Chuck Norris.|3.41|27|
Time flies when your having fun, not for Chuck Norris, time goes the speed Chuck Norris tells it.|3.41|27|
Steroids are just capsules filled with Chuck Norris' spit.|3.41|27|
Chuck Norris can beat Forrest Gump at a game of ping-pong.|3.41|27|
"The IRS asks Chuck Norris how much he would like to pay. ""Nothing"" is an acceptable answer."|3.41|27|
Chuck Norris was sitting in a lawn chair, smoking a cigar & chugging a fifth of Goldschl�ger when he zoomed by Felix Baumgartner on the way down.|3.41|27|
Chuck Norris has the iPhone with the whole apple in the back.|3.41|27|
"Tom Clancy has to pay Chuck Norris royalties because ""The Sum of All Fears"" is the name of Chuck Norris' biography."|3.41|22|
OJ didn't do it. Chuck Norris did.|3.41|22|
Chuck Norris can double jump.|3.41|22|
Chuck Norris can shoot you with a knife.|3.41|22|
"Chuck Norris went looking for a rabbit in a forest. He came out with a bear and the bear was saying ""I'm a rabbit, I'm a rabbit""."|3.41|22|
Chuck Norris can lock a computer screen with a pad lock.|3.41|22|
Chuck Norris can play frisbee...by himself.|3.41|22|
"Chuck Norris was considered as a contestant on ""Celebrity Apprentice"" but was rejected because there would only be one episode."|3.41|22|
Chuck Norris dosn't have alligator skin luggage.....alligators willingly carry Chuck Norris's clothes around for him.|3.41|22|
Only Chuck Norris is allowed to gamble with Monopoly money.|3.41|22|
When Chuck Norris runs a race, he ties both legs behind his back, just to make it fair.|3.41|22|
Volcanoes happen because sometimes Chuck Norris climbs mountains.|3.41|17|
Chuck Norris can break mighty putty.|3.41|17|
Chuck Norris can play ice hockey on lava.|3.41|17|
Viagra is just a tablet made of Chuck Norris earwax.|3.41|17|
Chuck Norris does not fart or burp. Nothing escapes Chuck Norris.|3.41|17|
Microsoft's latest operating system has a new user account. It's called the Chuck Norris account. It can delete the operating system and the hardware.|3.41|17|
Chuck Norris can change his DNA.|3.41|17|
IRS pays tax to Chuck Norris.|3.41|17|
Gum won't stick to Chuck Norris's shoe.|3.41|174|
Donald Trump was able to initiate talks with North Korea only because he threatened to send Chuck Norris to clean up their nuclear arsenal.|3.41|144|
Chuck Norris cured leprosy just by giving it the finger.|3.41|98|
Chuck Norris jokes/facts aren't funny unless Chuck Norris says you can laugh.|3.41|98|
Chuck Norris once faught Jackie Chan, Jet Li, Indiana Jones, MacGyver and Superman, Chuck Norris pinned them all in 4.32 seconds, the ref was also pinned.|3.41|71|
"If evolution was truly ""Survival of the Fittest"" then there'd only be CHUCK NORRIS!"|3.41|66|
Gravity does not keep Chuck Norris down, he holds gravity up.|3.41|66|
Chuck Norris doesn't travel, the destination comes to him..|3.41|58|
