Text|Rating|Votes|J/N
Chuck Norris voted for Trump to win the election, and his vote alone, killed any chance Hillary had of winning.|2.97|143|
Donald Trump won the US election because Chuck Norris allowed him to.|2.97|90|
Chuck Norris doesn't need internet to play on xbox live.|2.97|33|
When Chuck Norris plays Oregon trail, his family does not die of cholera or dysentery, but rather roundhouse kicks to the face. His wagon and livestock never get stuck in the mud, either, since he carries all of it on his back. He always makes it to Oregon before you.|2.97|33|
Flowers only smell nice becuase Chuck Norris says they do.|2.97|31|
The only reason the color pink still exists is because Chuck Norris is color blind.|2.97|30|
Chuck Norris possesses demons.|2.97|30|
Everything Chuck Norris owns is made of metal.|2.97|29|
In the last 20 years Chuck Norris hasn't aged a day. In fact! He's 10 years younger.|2.96|68|
Dumb blondes used to be smart until they got roundhouse kicked in the face by Chuck Norris.|2.96|55|
Chuck Norris can pee lasers|2.96|53|
Chuck Norris can beat the masterhand in a thumb wrestle.|2.96|52|
Chuck Norris is the reason the world is round.|2.96|50|
Chuck Norris doesnt fall, the ground stands up.|2.96|28|
Chuck Norris bought his car with monopoly money.|2.96|28|
Chuck Norris is so tough that he doesn't go coo coo for coco puffs.|2.96|27|
"Signs that say ""This is not an exit"" do not apply to Chuck Norris."|2.96|27|
Chuck Norris found the Lost Weekend.|2.96|27|
The reason a major asteroid hasn't hit the earth for thousands of years is because Chuck Norris roundhouse kicks them just before they strike earth.|2.96|26|
Chuck Norris is the reason why Osama Bin Laden is hiding.|2.96|25|
On myspace Chuck Norris has you as a friend, but you dont know that.|2.96|25|
Chuck Norris cooks by round house kicking his food to the sun and back.|2.96|25|
A Texas Hwy Patrol officer followed Chuck Norris for 95 miles, observed him throw out 27 beer cans then pulled him over and gave him a written warning for littering.|2.96|25|
Only Chuck Norris can stop forest fires.|2.96|24|
Crop circles are Chuck Norris' way of telling the world that sometimes corn needs to lie the fuck down.|2.96|24|
A Chuck Norris roundhouse kick is the equivalent of the Sonic Boom.|2.96|23|
Chuck Norris can pluck the feathers off of a worm.|2.96|23|
Chuck Norris lives in an upstairs basement.|2.96|23|
Chuck Norris got Manti Teo's girlfriend pregnant.|2.96|23|
Chucks Norris can get Chick-fil-A on Sundays.|2.96|23|
Chuck Norris can un bake bread.|2.95|44|
The day Chuck Norris got braces he pulled them off with his tongue.|2.95|41|
The reason a yo-yo will come back to you when you throw one down is because Chuck Norris is at the other end.|2.95|41|
Every morning Chuck Norris has a bowl of nails for breakfast, without any milk.|2.95|41|
Pedro voted for Chuck Norris.|2.95|40|
Chuck Norris does magic tricks for David Blaine.|2.95|39|
Chuck Norris once made a paper airplane. It is now up and running in Chicago.|2.95|38|
When Chuck Norris goes to the bathroom he doesn't take a dump, the toilet does.|2.95|22|
Every time Chuck Norris farts an angel gets it's wings.|2.95|22|
"Chuck Norris is the only person who can ""Crank Dat Chuck Norris.""."|2.95|22|
Chuck Norris wears asbestos underwear because he sharts napalm.|2.95|21|
Cuck Norris' theme music is funeral music.|2.95|21|
When confronted by Venom from Marvel comics Chuck Norris simply said a word and Venom decided to eat his own life force.|2.95|21|
When Chuck Norris gets shot, the bullet doesn't pierce Chuck Norris. Chuck Norris gets Pierce Brosnan.|2.95|21|
Chuck Norris makes money grow on trees.|2.95|21|
When Chuck Norris passes go, he collects your soul and sends you to jail.|2.95|21|
"Inside the warhead of a nuclear missile, there is a tiny little 0.1 oz can marked ""whoop ass"". it contains a milligram of Chuck Norris."|2.95|21|
Mr.T ,Chuck Norris and Bruce Lee all meet at the Bermuda triangle for a game of hungry hippo once a month!!|2.95|20|
Chuck Norris jogs around the earth 3 times a day.|2.95|20|
Chuck Norris was a judge on the last Season of X-Factor, and he won.|2.95|20|
Chuck Norris made Elmo cry.|2.95|20|
Mario Can beat up anyone.......Except Chuck Norris.|2.95|19|
Chuck Norris defeated GodZilla with just one hand.|2.95|19|
If Chuck Norris stops walking there will no longer be wind on earth.|2.95|19|
Kids at birthday parties try to get all candles blown out in one breath. Chuck Norris trys to get Forest Fires out in one breath.|2.95|19|
The dinosaurs became extinct because Chuck Norris said so.|2.94|49|
Chuck Norris doesn't use a remote control. He gives his TV orders. And it obeys.|2.94|36|
Why did the chicken cross the road? Chuck Norris was chasing him.|2.94|35|
Chuck Norris hit a moose when he was driving. It came down in Africa.|2.94|35|
Chuck Norris doesn't put his pants on, the pants put themselves on.|2.94|34|
People arn't really deaf, Chuck Norris just doesn't want them to hear.|2.94|33|
When the Zombie Apocalypse happens, the zonbies aren't running at you, they are all running away from Chuck Norris.|2.94|32|
When Chuck Norris is the QB he is also the wide receiver.|2.94|31|
When Chuck Norris holds two magnets. They stick to him.|2.94|18|
Who wears short shorts? Chuck Norris wears short shorts.|2.94|18|
Chuck Norris scares ghosts so bad when he says boo that they come back to life just so he can roundhouse kick them in the face and kill them again.|2.94|18|
God told Noah to build the arc when Chuck Norris told God he was going for a swim.|2.94|18|
There is only one thing that makes the world go round......A Chuck Norris roundhouse kick!|2.94|18|
Chuck can fry bacon wearing only boots!|2.94|18|
There is water on mars becouse Chuck Norris did a canonball in the artiic ocean.|2.94|17|
Chuck Norris gives bats rabies.|2.94|17|
Chuck Norris can fatten a cow on the day of slaughter.|2.94|17|
Chuck Norris can survive in the wilderness for months with just a toothpick. Give him 2 toothpicks and he's moving in.|2.94|17|
The faster Chuck Norris runs, the faster the earth spins.|2.94|16|
Chuck Norris answered the phone, and the caller got a RoundHouse kick in the face.|2.94|16|
B.P's live cam of the oil spill is actually Chuch Norris holding a video cam.|2.94|16|
"Chuck Norris' first words were ""I Win""."|2.94|16|
Chuck Norris round house kicked a guy in the face. He is now the most interesting man in the world!|2.94|16|
Chuck Norris has never died on Call of Duty Multiplayer.|2.94|16|
"Chuck Norris saw a movie that starred Chuck Norris. The real Chuck Norris asked some people in the theater, ""Who is that guy? I could kick his ass!""."|2.94|16|
Chuck Norris stole the cookie from the cookie jar.|2.93|122|
For Chuck Norris to get a tattoo, the artist would need a .50 cal machine gun as a needle.|2.93|102|
Chuck Norris isn't afraid of getting cancer only because he knows cancer is too afraid of getting Chuck Norrised!|2.93|67|
Chuck Norris had seen chocolate rain.|2.93|43|
Chuck Norris can stare at the sun.|2.93|40|
Tsunamis are created by Chuck Norris practicing round house kicks on the beach.|2.93|30|
Obiwan dissapeared cause he knew Chuck Norris was coming.|2.93|29|
Chuck Norris can hit a baby and get away with it.|2.93|29|
Chuck Norris is left-handed. And right-handed.|2.93|29|
Chuck Norris can climb a tree with his eyes.|2.93|28|
Chuck Norris doesn't run red lights he never runs.|2.93|28|
Chuck Norris is why World of Warcraft is abbreviated as WoW.|2.93|27|
When my wife and I make love she pretends I'm Chuck Norris amd I pretend I'm her.|2.93|27|
In a National Parks and Forests Chuck Norris can feed the bears.|2.93|15|
You are so unimportant to Chuck Norris that he has already forgotten when he will kill you.|2.93|15|
It's okay that the START treaty was passed. We never signed a Chuck Norris reduction treaty.|2.93|15|
When Sharks see Chuck Norris, they swim for shore.|2.93|15|
When a bear encounters Chuck Norris, he will ask him permission to go use the bathroom someplace besides the woods.|2.93|15|
The wheels on the bus used to be still, until Chuck Norris roundhouse kicked em.|2.93|14|
Chuck Norris can strike a match with a bar of soap.|2.93|14|
Chuck Norris likes his ice crushed. Same with his skulls.|2.93|14|
Once, Chuck Norris had a bad day...just to see what it feels like.|2.93|14|
Chuck Norris WALKS at mach 3.|2.93|14|
Chuck Norris can cut diamonds with a beach ball.|2.93|14|
You can lead a horse to water, but Chuck Norris can make him drink!|2.93|14|
Chuck Norris taught the STIG how to drive cars.|2.93|14|
If you sacrifice 87 virgins to Chuck Norris, he will grant you one wish.|2.92|52|
Chuck Norris once decided to microwave a burrito so hot that he himself could not eat it. Then he ate it.|2.92|50|
You could stick a fork in Chuck Norris but he still wouldn't be done. Chuck Norris isn't done until Chuck Norris says he's done!|2.92|49|
Chuck Norris invented guns only because he needed a somewhat of a fare fight when it came time for him to spill some blood.|2.92|39|
"In 1990, Chuck Norris founded the non-profit organization ""Kick Drugs Out of America"". If the organization's name were ""Roundhouse Kick Drugs out of America"", there wouldn't be any drugs in the Western Hemisphere. Anywhere."|2.92|38|
The Mr Universe Competitions are tributes to Chuck Norris.|2.92|38|
The reason Criss Angel levitates is because he insulted Chuck Norris and he doesn't want to die.|2.92|37|
George Washington didn't really cut down the cherry tree. Chuck Norris roundhouse kicked it and made George take the blame.|2.92|26|
Chuck Norris can punch you with a roundhouse kick.|2.92|26|
Only Chuck Norris can prevent forest fires, but he really likes gigantic toasted marshmallows.|2.92|26|
Few people know that Chick Norris was the first person who was asked to play King Leonidas. After asking the question the director realized that the name and whole plot of the movie would have to be changed from 300 to 1 and the fact that Chuck Norris wouldnt even pretend to die. Following this thought he was killed by a roundhouse kick to the face. The only 299 people behind Chuck Norris are the ones who hes killed.|2.92|24|
Chuck Norris doesn't have a six pack. He goes straight to the keg.|2.92|24|
If you were killed by Chuck Norris, your tombstone would read RIP, ripped into pieces.|2.92|24|
Chuck Norris� mom didn�t have a natural birth. He Roundhouse kicked the inside of her stomach until it exploded.|2.92|24|
Leopords have spots because Chuck Norris Punched them all.|2.92|13|
When Chuck Norris dumped Beyonce, everything he owned didn't fit in a box to the left, Chuck Norris owns everything.|2.92|13|
"What Chuck Norris calls ""sun-block"" the rest of us call a solar eclipse."|2.92|13|
Chuck Norris jailbroke Steve Job's iPhone.|2.92|13|
Chuck Norris loves his cookies. That is the only reason why Santa Claus no longer exists.|2.92|13|
When Chuck Norris flew in, his arms weren't tired.|2.92|13|
Chuck Norris can jump out of his clothes.|2.92|13|
Chuck Norris can go around the world in 79 days.|2.92|12|
Propofol didn't kill Michael Jackson. Conrad Murray introduced him to Chuck Norris.|2.92|12|
Chuck Norris has a holiday house in area 51.|2.92|12|
Siri asked Chuck Norris if she could help. Chuck Norris roundhouse kicked his phone, claiming Chuck Norris never needs help.|2.92|12|
Chuck doesn't have a funny bone. It's called his manly bone.|2.91|78|
"Clint Eastwood's favorite movie is ""The good, the bad, and the Chuck Norris."""|2.91|56|
Chuck Norris round house kicks people who make Chuck Norris jok... %|2.91|47|
When Chuck Norris plays Oregon Trail his family does not die from cholera or dysentery, but rather roundhouse kicks to the face. He also requires no wagon, since he carries the oxen, axels, and buffalo meat on his back. He always makes it to Oregon before you.|2.91|46|
Chuck Norris doesn't cut his grass he stares at it and dares it to grow.|2.91|35|
What's blood? The thing you'll see after Chuck Norris sees you.|2.91|33|
Chuck Norris can count all of the stars in the sky. In fact, he does it three times a night.|2.91|32|
Blinking is a waste of time for Chuck.|2.91|32|
Chuck Norris dosent use Viagra. He uses snake vemon.|2.91|23|
Chuck Norris wears YOUR heart on his sleeve.|2.91|23|
When you die the white light you see is not heaven. It`s the trail left by Chuck Norris after he`s roundhouse kicked you.|2.91|23|
We have nothing to fear, but...Chuck Norris.|2.91|23|
Chuck Norris got his drivers license at the age of sixteen seconds.|2.91|23|
Chuck Norris can lock you in an invisible box.|2.91|22|
Chuck Norris beat Shao Kahn to death with his own lifebar in Mortal Kombat 3.|2.91|22|
Chuck Norris can turn water into beer.|2.91|22|
Between AM and FM there is only Chuck Norris.|2.91|11|
You can tell that Chuck Norris is thinking about you, because it stings when you pee.|2.91|11|
"When Chuck Norris goes to Rita's his favorite flavor is ""make me a sandwich""."|2.91|11|
Nobody doesn't like Sara Lee. Except Chuck Norris.|2.9|110|
When your in Texas don't look behind you because that's where a roundhouse kick is gonna be.|2.9|77|
Chuck Norris was a first responder but he quit because people wanted him to use the defibrillators, not roundhouse kicks.|2.9|72|
Chuck Norris can get a tetris with three lines.|2.9|42|
The Sun Is Chuck Norris's clap on lamp.|2.9|40|
Chuck Norris is 1/8th Cherokee. This has nothing to do with ancestry, the man ate an Indian.|2.9|31|
"Chuck Norris can make all conversations a ""That's what she said"" conversation."|2.9|31|
Chuck Norris had a party and invited celebrities. Tom Cruise cannot get in, because Chuck Norris does not take shit.|2.9|30|
Do you know that Chuck Norris participated in the running of the Bulls in Spain. He walked!|2.9|30|
Chuck Norris is so strong he made Mr. T look white and Micheal Jackson look black.|2.9|21|
The secret ingredient to the Krabby Patty is Chuck Norris.|2.9|21|
Chuck Norris once took a deep breath in Miami, and the next day Hurricane Katrina began.|2.9|20|
Some kids create an angel in the snow by lying down and moving their arms and legs. Chuck Norris can clear Aspen from all it's snow by doing that.|2.9|20|
Chuck Norris recieves all the marijuana the border patrol confiscates as tribute for stopping immigration.|2.9|10|
Chuck Norris travels to the Twilight Zone for a vacation.|2.9|10|
Chuck Norris can build a house with Thor'z hammer...|2.9|10|
Chuck Norris can pitch a perfect game without throwing a strike.|2.9|10|
If you have never met your Father....Its probably Chuck Norris!|2.9|10|
"""I kill, therefore I am."" -Chuck Norris"|2.89|66|
Chuck Norris reads the dictionary every night befor he goes to sleep.|2.89|54|
If you lined a list of Chuck Norris's enemies and exctinct animals together, they match.|2.89|54|
How many licks does it take Chuck Norris to get to the center of a lollipop? 0. He Just stares at it to get to the center.|2.89|45|
Chuck Norris's beard isn't a beard. It's a cover for his third fist.|2.89|36|
Bill Gates is friends with Chuck Norris on XBOX Live.|2.89|28|
When the lightning flashes and the thunder crashes, Chuck Norris just gave someone a roundhouse kick to the face!|2.89|27|
They say the banks control the country. The Fed controls the banks. The Rothchilds control the Fed. And Chuck Norris controls it all.|2.89|27|
Chuck Norris is so strong, he can stop the unstoppable force, and move an immovable object.|2.89|19|
Chuck Norris voted Republican... Thats why Obama's hair turned gray.|2.89|19|
Chuck Norris carried King Kong up the Empire State Building.|2.89|19|
"Chuck Norris is what ""willis"" is talking about."|2.89|19|
Chuck Norris is so smart, it makes bill Gates look dumb.|2.89|19|
Evel Knievel aborted his jump over the Snake River Canyon because Evel saw Chuck Norris crouched in attack position on the other side of the canyon.|2.89|19|
Chuck Norris knows where his car keys are. Always.|2.89|19|
Chuck Norris sleeps underwater.|2.89|19|
"Chuck Norris can win the game, ""Kick the Can"" without a can."|2.89|19|
Chuck Norris does not stand in lines, lines stand in Chuck Norris.|2.89|18|
Tom comments Chuck Norris' Myspace.|2.89|18|
Bees are allergic to Chuck Norris stings.|2.89|18|
Chuck Norris can beat you in and under water breathing contest even when you are using a snorkel.|2.89|18|
Chuck Norris has never won a fair fight never, because no fight with Chuck Norris is fair.|2.89|18|
Mac switched to Chuck Norris.|2.89|18|
Why is Goldman Sachs in trouble? Chuck Norris shorted them.|2.89|9|
Chuck Norris doesn't exercise. He does hero-bics.|2.89|9|
Life doesn't take Visa. Life takes Chuck Norris|2.88|50|
Everyone pay $5 for there foot long. But Chuck Norris Charges $6 for his foot long.|2.88|43|
Chuck Norris' android smart phone came preinstalled with Siri.|2.88|34|
When Chuck Norris plays monopoly he passes go and collects $200 on every turn.|2.88|34|
The grand canyon was a result from Chuck Norris roudhouse kicking the ground.|2.88|32|
Chuck Norris was made an offer once. He refused.|2.88|26|
The story about the dreadful Ring and the cursed girl was ended exactly seven days after Chuck Norris had watched the videotape.|2.88|25|
Chuck Norris's nickname is Chuck Norris.|2.88|25|
Chuck Norris could roundhouse kick bill gates and turn his company into Microhard.|2.88|25|
Chuck Norris grew an extra finger on each hand so he could shoot more guns at the same time.|2.88|25|
When Chuck Norris runs with scissors he hurts other people.|2.88|24|
When Chuck Norris plays tic tac toe he can get three O's in a row before you get down a single X without cheating.|2.88|24|
"Chuck Norris first words were, ""I'm going to roundhouse kick you in the face."""|2.88|17|
Chuck Norris always has been, and always will be exactly 69 years old.|2.88|17|
If Chuck Norris roundhouse kicked the Earth, it would split in two,and that's with no legs or feet!|2.88|17|
Chuck Norris's birthday is BC infinity.|2.88|17|
Chuck Norris can drive a car on cinder blocks.|2.88|17|
Chuck Norris once ate an Oreo....and crapped out a dalmation.|2.88|17|
Chuck Norris can block the sun with his thumb.|2.88|17|
Chuck Norris will cause 2012.|2.88|17|
Chuck Norris blinded love.|2.88|17|
Chuck Norris' earlobes are bullet proof.|2.88|17|
Chuck Norris sleeps with two eyes open.|2.88|17|
Chuck Norris CAN get blood from a turnip-and anything else he roundhouse kicks.|2.88|16|
Chuck Norris can turn 50 cent into 2 quaters.|2.88|16|
Chuck Norris is so tough, that Walker, Texas Ranger, was allowed to air.|2.88|8|
Chuck Norris doesn't throw up if he drinks too much. Chuck Norris throws down!|2.87|148|
When Steven Seagal kills a ninja, he only takes its hide. When Chuck Norris kills a ninja, he uses every part.|2.87|134|
Chuck Norris can see through Count Olaf's disguises.|2.87|101|
An ark was built. Chuck Norris sneezed. After 40 days & nights only a few survived.|2.87|60|
"""Nobody makes me bleed my own blood...except for Chuck Norris"""|2.87|52|
Chuck Norris can get blackjack with 3 and an ace.|2.87|31|
Chuck Norris didn't rest on the 7th day.|2.87|31|
Chuck Norris likes fish sticks and isnt a gay fish.|2.87|31|
An NBA player can dunk a basketball. Chuck Noriss can dunk an NBA basketball player.|2.87|23|
Chuck Norris has a bowl of nails every morning, just to get his daily dose of PAIN.|2.87|23|
Every Gun family owns a Chuck Norris for self-protection.|2.87|23|
The only reason bigfoot is hiding is because he stole Chuck Norris' body hair.|2.87|15|
Chuck Norris showed the New Boyz how to Jerk.|2.87|15|
Chuck Norris got attacked by Chuck Norris and Chuck Norris won.|2.87|15|
Chuck Norris invented decaf coffee by punching a coffee bean.|2.87|15|
When Chuck Norris was born The Lion King bowed down to him.|2.87|15|
Zombies are what you get when you try to be Chuck Norris for halloween.|2.87|15|
Chuck Norris let the dogs out... And no one is going to do anything about it.|2.87|15|
Chuck Norris can beat a bullet in a race while putting his boots on.|2.87|15|
If you posion Chuck Norris he spits it in your eye.|2.87|15|
Chuck Norris can squeeze carviar out of a lemon.|2.86|84|
"""Cr�me de la cr�me"" is a term directly related to Chuck Norris' groin."|2.86|49|
"when God said let their be light Chuck Norris stepped in front of him and said ""say please"""|2.86|43|
When Chuck Norris farts California has an earthquake.|2.86|37|
The law of Conservation of matter is wrong. Chuck Norris's roundhouse kick can destroy matter without altering it.|2.86|35|
When a tree falls in a forest and noone's around to hear it, does it make a noise? I dunno, go ask Chuck. He'll know. He was there.|2.86|29|
Chuck Norris made Mr. Miagi tar his driveway, clean his gutters and get his dry cleaning.|2.86|29|
When Chuck Norris goes to kill a Vampire... He uses his fist instead of a stake. His fist can kill anyone.|2.86|29|
The civil war really ended because Chuck Norris threatened the south.|2.86|29|
The story of Noah and the Red Sea was inspired by what happens when Chuck Norris walks down a crowded street.|2.86|28|
Mythbusters asks Chuck Norris if myth is busted.|2.86|28|
Chuck Norris hasn't 'lost' his virginity, he just keeps loaning it out.|2.86|28|
Chuck Norris does't need scuba diving gear, he just holds his breath.|2.86|22|
I once had a fight with Chuck Norris. Within three second he had twisted me into an animal balloon.|2.86|22|
Chuck Norris fought the law, and Chuck Norris won.|2.86|22|
Chuck Norris can build a house with only paper and tape.|2.86|22|
Chuck Norris invented oatmeal when he round house kicked a quaker.|2.86|22|
Chuck Norris can trip an amputee.|2.86|22|
Chuck Norris can shampoo with conditioner.|2.86|22|
Chuck Norris prefers Burger King because McDonalds hasn't invented the biggest mac yet.|2.86|21|
Chuck Norris' dog NEVER begs, he demands...|2.86|21|
Once Chuck Norris and Mr. T were selected to box each other. The audience was empty because nobody would pay to see a fight that lasted .00001 seconds.|2.86|21|
Chuck Norris doesn't dance around the question. Questions dance around Chuck Norris.|2.86|21|
Chuck Norris has a pet veloceraptor. He got it at a candy store three years ago.|2.86|21|
The movie Friday the 13th is a version of Walker: Texas Ranger, but it has less violence.|2.86|14|
Only Chuck Norris can prevent forest fires.|2.86|14|
Chuck Norris doesn't have emotions, he shows his feelings with a series of punches and roundhouse kicks.|2.86|14|
The movie godzilla was a depiction of Chuck Norris's first visit to tokyo.|2.86|14|
Chuck Norris is the real Slim Shady.|2.86|14|
Both sides of Chuck Norris pellow are cold.|2.86|14|
The most grueling job in the world.......sifting through a list of Chuck Norris's daily victims to find the organ donors.|2.86|14|
Chuck Norris does not have a twitter because he is already always following you.|2.86|14|
When Chuck Norris blinks he starts an avalenche.|2.86|14|
Chuck Norris was the president of the School of Hard Knocks.|2.86|7|
Chuck Norris once swallowed a frog, one day later he and pooped out a tadpole.|2.85|313|
Chuck Norris doesn't breathe fire, fire breathes Chuck Norris.|2.85|92|
You can't be stuck in a Black-Hole with Chuck Norris. Chuck Norris is the Black-Hole.|2.85|92|
Chuck Norris can chew his own head off.|2.85|87|
A Chuck Norris round house kick is the #1 form of execution in prisons in 49 states. It would be 50 but Texas refused to accept it so Chuck Norris refused to accept Texas and round hose kicked it into Mexico.|2.85|47|
Chuck Norris did hit that.|2.85|46|
Chuck Norris and Bruce Lee WERE friends. They were friends until chuck stole his wife.|2.85|33|
Immortal is greek for Chuck Norris.|2.85|33|
Chuck Norris trains speeding bullets.|2.85|33|
Chuck Norris' stare is so sharp he can cut sub-atomic particles in half.|2.85|27|
Santa's reindeer can fly because Chuck Norris roundhouse kicks them into the sky.|2.85|26|
Chuck Norris can cock his leg and shoot toes.|2.85|26|
Chuck Norris doesn't use an oven, he heats things with his eyes.|2.85|26|
If it doesn't involve a roundhouse kick Chuck Norris didn't do it.|2.85|20|
Chuck Norris makes coffee nervous.|2.85|13|
"Chuck Norris can define the word ""a""."|2.85|13|
Chuck Norris gives Adderall ADHD.|2.85|13|
Chuck Norris isn't Irish, his hair is just streaked with the blood of his victims.|2.85|13|
Chuck Norris was an anti aircraft gun in world war two.|2.85|13|
Chuck Norris can hear a dog whistle.|2.85|13|
Where can a 400 Lb. Gorilla sleep? Anywhere it wants. Expect Chuck Norris's house.|2.84|90|
Chuck Norris can inhale through his nose and mouth at the same time.|2.84|50|
Chuck Norris says that an apple is a fruit AND a vegetable.|2.84|38|
The law of gravity applies to everything. Except Chuck Norris.|2.84|37|
Chuck Norris can run around the world and give himself a highfive.|2.84|32|
Chuck Norris died a guys hair blue with brown hair color.|2.84|32|
Chuck Norris figured out the ending to The Sixth Sense while the opening credits were still on the screen.|2.84|31|
A solar eclipse happens when Chuck Norris can't be bothered to put on sunglasses.|2.84|19|
Chuck Norris was a contestant on the 1 vs 100 Finale. They haven't broadcasted since.|2.84|19|
Chuck Norris pisses on eletric fences for fun.|2.84|19|
Chuck Norris already has a 5D TV.|2.84|19|
Chuck Norris doesn't have layers of skin. He just has layers of tight denim.|2.83|58|
In England people have mums because Chuck Norris humped the top of the O off.|2.83|53|
When chuck Norris blows up a balloon, it pops before he even starts out of fear.|2.83|41|
Chuck doesn't need Nutrition Facts. He decides what nutrients he gets from eating something.|2.83|40|
The Death Star is just one of Chuck Norris's balls.|2.83|35|
Chuck Norris can hold three tommy guns at once. One in one hand. Another in the other hand. And another in the third hand.|2.83|30|
Chuck Norris got hit by a car and then it blew up.|2.83|30|
