Text|Rating|Votes|J/N
Donald Trump can't fire Chuck Norris.|3.88|50|j
A rainbow's favorite color is Chuck Norris.|3.88|49|n
Two calculators are needed to add up Chuck Norris' IQ.|3.88|43|n
Chuck Norris once rode a Brahma Bull in a rodeo.....nine months later it had a calf.|3.88|43|n
Chuck Norris receives an annual sum of 10 million dollars from Viagra as royalties for the chemical compounds found in his blood.|3.88|42|n
Staring at Chuck Norris is bad for the sun.|3.88|41|j
Chuck Norris doesn't have 'body hair,' his skin sheds in the form of steel-wool.|3.87|39|j
Chuck Norris has a turbo diesel. On his bicycle.|3.87|31|n
Chuck Norris once lost a fight. Then he woke up.|3.87|31|j
Chuck Norris can smell in color.|3.87|30|n
Some people use Visine to moisten their eyes. Chuck Norris uses pepper spray.|3.87|30|n
Chuck Norris can beat scissors with paper.|3.87|30|j
Chuck Norris once hosted Saturday night live, but no one had the guts to laugh at him.|3.87|23|n
There is no such thing as global warming, Chuck Norris got cold and turned up the earths thermostat.|3.87|15|n
When Roald Amundsen reached the South Pole, he was greeted by the sight of Chuck Norris sipping a cup of hot chocolate while basking naked in the Antarctic sun.|3.87|15|n
Chuck Norris can prepare a 5 star gourmet dinner out of onion, toejam and Wheaties.|3.87|15|n
Chuck Norris can do the cinnimon challenge when he has a sore throat.|3.87|15|n
The mayor has a directline to batman, but batman has a directline to Chuck Norris.|3.87|15|n
Chuck Norris once killed 37 terrorists with only 2 bullets....the first bullet was a warning shot.|3.87|62|n
They once invented a Chuck Norris brand of toilet paper. It was discontinued shortly after for not taking shit from anyone.|3.87|61|j
Chuck Norris is currently suing NBC, claiming Law and Order are trademarked names for his left and right legs.|3.87|55|j
Chuck Norris once partook in a pissing contest outside of a bar. His opponent drowned.|3.87|54|n
Kobeiashi can eat 56 hotdogs, but Chuck Norris can eat 65 japanese people.|3.87|52|n
Chuck Norris can make a straight line gay.|3.87|47|n
Chuck Norris is the reason Rambo has scars.|3.87|46|n
Chuck Norris once got in a fight with Jean Claude Van Damme. There were 3 hits. Chuck hitting Van Damme, Van Damme hitting the floor, and the ambulance hitting 90, trying to get Van Damme to the hospital in time.|3.87|46|n
Chuck Norris strapped a bomb onto himself and ran for an Al-Quidea camp. When it blew up, Chuck Norris was still running.|3.86|37|n
Chuck Norris wrote an autobiography about you.|3.86|37|n
Chuck Norris can create a rainbow using only one color.|3.86|36|n
Chuck Norris fell off of the Empire State building and stubbed his toe.|3.86|29|j
The Joker is permanently smiling because he once heard Chuck Norris tell a joke.|3.86|29|n
When Chuck Norris plays pokemon he does catch them all.|3.86|29|n
Chuck Norris is not above the law, he is the law.|3.86|28|j
When you split an atom, inside it says OWNED BY CHUCK NORRIS.|3.86|28|n
Chuck Norris is so American he can eat chinese food and crap an apple pie.|3.86|28|n
Chuck Norris can dribble a football across a baseball field and score a 3 pointer.|3.86|28|n
Chuck Norris can choose whether his poop stinks or not.|3.86|22|n
When Chuck Norris walks through the woods, Big Foot takes a picture of him.|3.86|22|n
Chuck Norris can rehydrate petrified wood by urinating on it.|3.86|22|n
China once bordered the U.S but Chuck Norris roundhoused kicked it across the Earth.|3.86|21|n
When a normal human drinks Red Bull, they get wings. When Chuck Norris drinks Red Bull, there are no survivors.|3.86|21|n
Chuck Norris eats inside Sonic.|3.86|21|n
When Chuck Norris listens to dubstep he sings along.|3.86|21|j
Chuck Norris can catch a bunt from center field.|3.86|21|n
Chuck Norris is the only person who can move all his luggage to the car in less than one trip.|3.86|14|n
The Devil went down to Georgia because Chuck Norris lives in Oklahoma.|3.86|14|n
Vince Vaughn became a movie star for being the guy that got Chuck Norris to appear in Dodgeball for five seconds.|3.86|14|n
"Few people are aware that the entire lead-in of the Iron Butterfly hit ""In-A-Gadda-Da-Vida"" was actually recorded solely by Chuck Norris playing a piccolo."|3.86|14|n
Chuck Norris planted money and grew a bank.|3.86|14|n
Weights come to Chuck Norris for strength training.|3.86|14|n
Chuck Norris can perform plastic surgery with his bare hands.|3.86|14|j
Chuck Norris sold his soul to the devil for his rugged good looks and unparalleled martial arts ability. Shortly after the transaction was finalized, Chuck roundhouse kicked the devil in the face and took his soul back. The devil, who appreciates irony, couldn't stay mad and admitted he should have seen it coming. They now play poker every second Wednesday of the month.|3.86|66|n
Chuck Norris can roundhouse kick you with his legs tied behind his back.|3.86|65|j
One Chuck Norris roundhouse kick can power Australia for 45 minutes.|3.86|43|n
"Chuck Norris was once asked in an interview what he thought about all the Chuck Norris jokes going around. He simply said ""They aren't jokes"" and went back to drinking his mug of nails."|3.85|89|j
Chuck Norris once got an erection while laying face down. He struck oil.|3.85|78|n
Chuck Norris can kick a field goal in Qualcomm Stadium from the 20 yard line of Giants Stadium.|3.85|40|n
"Someone once asked Chuck Norris how many licks does it take to get to the tootsie role center of a tootsie pop? Chuck then pulled out his gun and shot the tootsie pop and answered ""0""."|3.85|40|n
When Chuck Norris puts money in the parking meter, a gumball comes out.|3.85|39|n
Haley's Comet is all thats left of a snowball fight with Chuck Norris.|3.85|39|n
Chuck Norris doesn't fight wars. He settles them.|3.85|34|j
When Chuck Norris cuts himself shaving the razor bleeds.|3.85|33|n
Chuck Norris gave peas their black eyes.|3.85|33|n
All of Chuck Norris' chromosomes are male.|3.85|33|n
Chuck Norris knows everything there is to know - Except for the definition of mercy.|3.85|27|n
Chuck Norris can do a hand stand no handed.|3.85|27|n
Chuck Norris once killed someone with a cap gun.|3.85|27|n
You can't hurt Chuck Norris's feelings...... however, his feelings can sure as hell hurt you.|3.85|27|n
Chuck Norris can get pulled over by the police and give the police officer a ticket.|3.85|27|n
"Chuck Norris' business card simply says ""I'll call you""."|3.85|27|n
When Chuck Norris eats curry he shits out an indian.|3.85|27|n
Chuck Norris can steal home plate. From 2nd base.|3.85|26|n
Superman is able to leap tall buildings in a single bound. Chuck Norris can walk straight through tall buildings. And Superman.|3.85|26|n
When they asked Chuck Norris to star in the first James Bond movie � he refused and said; �I don�t need no license to kill�.|3.85|26|n
Steve Jobs is dead because Chuck Norris' IPad crashed.|3.85|26|n
Chuck Norris can see Ultra Violet light.|3.85|20|j
Chuck Norris is an incredible lawyer. He's won every case simply because you DON'T argue with Chuck Norris.|3.85|20|j
Chuck Norris can close a 24-hr store.|3.85|20|j
In the 1800s, Chuck Norris farted. The result, the London Smog.|3.85|20|n
Chuck Norris does not wear long sleeved shirts, he wears tank tops with sheaths.|3.85|13|n
Chuck Norris never attended recess in grade school, because Chuck Norris doesn't play.|3.85|13|n
The only sport Chuck Norris would score lower than you in is golf.|3.85|66|j
Chuck Norris does not go to Strip Clubs because women take off their clothes wherever he goes.|3.85|48|n
Iraq never held weapons of mass destruction, Chuck Norris just went on vacation.|3.85|46|n
Chuck Norris is so tough when he gets abducted by aliens he does the anal probing.|3.84|38|n
Chuck Norris can see John Cena.|3.84|37|n
Chuck Norris went as Chuck Norris as Halloween and got twice as much candy as anbody.|3.84|37|n
Chuck Norris can hear the sound of one hand clapping.|3.84|32|n
The square root of Chuck Norris is infinity.|3.84|32|n
Chuck Norris only skydived once, he thought the United States only needed one Grand Canyon.|3.84|32|n
Chuck Norris can get an eye exam blind folded.|3.84|32|n
Chuck Norris puts the FUN in Funeral.|3.84|31|n
If a bee stings Chuck Norris.... the bee swells up.|3.84|31|n
Chuck Norris once appeared on an episode of American Gladiators. It was the shortest episode in history.|3.84|25|n
Chuck Norris' beard is the only thing stopping his chin from kicking some ass.|3.84|25|n
Chuck Norris doesn't believe in evolution. Chuck Norris IS evolution.|3.84|25|n
Chuck Norris doesn't taste the rainbow he EATS it.|3.84|25|n
Chuck Norris can find nemo in the sahara desert.|3.84|25|n
Chuck Norris doesn't own a stove, oven, or microwave. this is because revenge is a dish best served cold.|3.84|25|n
It is better to have loved and lost than to have never loved at all...it is also better to have never loved at all than to have been round-house kicked in the face by Chuck Norris.|3.84|19|n
Chuck Norris plays bingo, with a paint ball gun.|3.84|19|n
France can't win wars by itself because it doesn't have Chuck Norris.|3.84|19|n
When Chuck Norris decides to use a gun instead of his fists, it's to give his opponents a sporting chance.|3.84|19|j
Chuck Norris has already written history books for the year 3000.|3.84|19|n
Chuck Norris sprinkles sharks teeth on his fish tacos.|3.84|19|n
Chuck Norris did in fact, build Rome in a day.|3.84|19|j
Chuck Norris can milk a bull.|3.84|19|n
When a state trooper pulls over Chuck Norris, he shows Chuck Norris his license and registration.|3.84|19|n
People don't tell Chuck Norris jokes, they simply tell his life story.|3.84|68|j
Anyone can piss on the floor, but Chuck Norris can shit on the ceiling.|3.84|45|n
Chuck Norris can piss into gale force winds.|3.84|44|n
Chuck Norris can set fire to magnifying glasses using ants.|3.84|43|n
Chuck Norris can hack a computer with a toothpick, pocket lint, and a tomato.|3.84|43|n
The opening scene to Saving Private Ryan is loosely based on a dodge ball game Chuck Norris had in kindergarten.|3.83|40|n
The police use Chuck Norris as their emergency contact number.|3.83|35|n
Chuck Norris doesnt ride into the sunset... The sunset automaticlly follows Chuck Norris.|3.83|30|n
Chuck Norris could never be a corrections officer because Chuck Norris takes no prisoners.|3.83|30|n
Chuck Norris invented the bolt-action rifle, liquor, sexual intercourse, and football-- in that order.|3.83|30|n
"Chuck Norris eats beef jerky and craps gunpowder. Then, he uses that gunpowder to make a bullet, which he uses to kill a cow and make more beef jerky. Some people refer to this as the ""Circle of Life.""."|3.83|30|n
Simon sometimes plays Chuck Norris says.|3.83|30|n
The only time Chuck Norris cried, Noah and his family were the only survivors.|3.83|30|n
Chuck Norris keeps bullets in his guns in case he gets hungry.|3.83|30|n
Chuck Norris can eat himself and live to tell the tale.|3.83|29|n
Wilt Chamberlain has claimed to slept with thousands of women. That's a slow Tuesday for Chuck Norris.|3.83|29|
Chuck Norris has more force than yoda.|3.83|24|
Chuck Norris's round house kicks don't kill you, they completely wipe your existence from the space time continuum.|3.83|24|
The square root of Chuck Norris is a roundhouse kick.|3.83|24|
Little kids look up to superheroes for protection. Super heroes look up to Chuck Norris.|3.83|24|
Old MacDonald had a farm, EIEIO. Chuck Norris punched him in the face, EIEIO. That's what made Old MacDonald get dyslexia, OIEIE.|3.83|24|
Chuck Norris can see a blind date.|3.83|24|
Chuck Norris finished the neverending story.|3.83|24|
When we first landed on the moon, the astronauts noted there was print on the moon that said “Chuck Norris was here”.|3.83|24|
If three hundred men decide to gang up on Chuck Norris, they would have to wait for three hundred more because at the moment, they are outnumbered.|3.83|23|
Kobe Bryant can swish a three pointer. Chuck Norris can swish a four pointer.|3.83|23|
The Roundhouse kick is Chuck Norris� second most deadly move; no one dared to ask about the first.|3.83|23|
Sharks have special protective suits they wear when Chuck Norris goes SCUBA diving.|3.83|23|
Chuck Norris's foot is a weapon of mass destruction. It destroys mass.|3.83|23|
"The ARMY is using Chuck Norris in its latest round of ""Be all that you can be"" commercials because even they know everyone wants to be Chuck Norris!"|3.83|18|
Godzilla was actually Chuck Norris's lost pet.|3.83|18|
Chuck Norris can make ballons out of animals.|3.83|18|
Silly Bandz are made from the intestines of all the men Chuck Norris has slaughtered in pure rage.|3.83|12|
Chuck Norris has never gotten his picture taken, because everybody knows you can't frame Chuck Norris.|3.83|12|
When Chuck Norris gets his toenails clipped they all come off at once, because everybody knows you can't go toe to toe with Chuck Norris.|3.83|12|
Chuck Norris scored a hat trick once in a hockey game....he was at home.|3.83|6|
Chuck Norris doesn't make wrong phone calls, people answer the wrong phone.|3.83|48|
Chuck Norris can dribble a football.|3.83|47|
Chuck Norris round housed kicked his cat into a dog.|3.83|42|
"After his wedding, Chuck Norris sent ""You're Welcome"" cards to his guests."|3.83|42|
Chuck Norris has won the lifetime achievement award...twice.|3.83|41|
"Elvis Presley, Richard Petty, Budweiser, and Michael Jackson all call Chuck Norris ""The King""."|3.82|76|
Chuck Norris enters the Matrix with administrator as username.|3.82|38|
The reason the Holy Grail has never been recovered is because nobody is brave enough to ask Chuck Norris to give up his favorite coffee mug.|3.82|34|
Chuck Norris mathematically proved that the bird is the word.|3.82|34|
Chuck Norris would never have a heart attack because his heart is not nearly foolish enough to attack him.|3.82|33|
If you work in an office with Chuck Norris, don't ask him for his 3 hole punch.|3.82|33|
Chuck Norris can arrange his skittles in alphabetical order.|3.82|33|
When Chuck Norris arrived at my birthday party the candles blew themselves out.|3.82|33|
"When the waitress asks Chuck Norris how he would like his eggs he replies, ""As they're hatching."""|3.82|28|
Chuck Norris does not need Twitter. He is already following you.|3.82|28|
"When Chuck Norris proposed to his wife, she replied, ""When pigs fly."" So Chuck Norris made pigs fly and they got married."|3.82|22|
Chuck Norris doesn't take a stand for or against gays in the military. Instead, he makes whole armies feel gay compared to his fearsome masculinity.|3.82|22|
When Chuck Norris throw a boomerang, it's afraid to return.|3.82|22|
Chuck Norris uses hippies as fire wood.|3.82|22|
What goes around comes around, except when it sees Chuck Norris it keeps going and never comes around again.|3.82|22|
When Chuck Norris played scary maze games, the face was too scared to pop up.|3.82|22|
Chuck Norris' shadow is 3D.|3.82|22|
Most kids are afraid of the mouse at Chuckie cheese because they are afraid that it is Chuck Norris in disguise.|3.82|17|
Chuck Norris gives beer a hangover.|3.82|17|
Chuck Norris can make a boomerang come back without throwing it.|3.82|17|
"Some people get ""thrown under the bus"", the bus gets thrown under Chuck Norris."|3.82|17|
Once Mike Tyson punched Chuck Norris so hard in the nuts. Mike Tyson needed major surgery.|3.82|11|
Chuck Norris never dies, he's just waiting to re-spawn.|3.82|11|
Chuck Norris can hit a bull in the butt with a banjo.|3.82|11|
Sasquatches watch messin' with Chuck Norris commercials.|3.82|11|
Chuck Norris can eat water.|3.82|11|
Chuck Norris answers your question before you have one.|3.82|11|
When chuck Norris does division, there are no remainders.|3.82|56|
For some, the left testicle is larger than the right one. For Chuck Norris, each testicle is larger than the other one.|3.82|51|
Chuck Norris' favorite flavor of Kool-Aid is Jack Daniels.|3.82|51|
Chuck Norris doesnt reload - he continues.|3.82|51|
911 calls Chuck Norris for help.|3.82|50|
If you give a man a fish, he will eat for a day. If you give Chuck Norris a fish, He will kill you with it because Chuck has no need for food, he is sustained from the blood of his enemies.|3.82|45|
Chuck Norris once killed an entire army in an hour with just a revolver. If only he had some bullets.|3.82|44|
Chuck Norris doesn't wear condoms because their is no protection against Chuck Norris.|3.81|85|
Chuck Norris once fought the Grim Reaper...thats why he's a skeleton|3.81|83|
There are no Weapons of Mass Destruction in Iraq. Chuck Norris lives in Oklahoma.|3.81|37|
Chuck Norris eats beef jerky, shits out gun powder, makes the gun powder into a bullet which he uses to shoot another cow to make more beef jerky... This is known as the circle of life.|3.81|37|
Chuck Norris once won a dogfight with an 10 - J - 10 fighter jet. Chuck was flying an air Ballon.|3.81|36|
Chuck Norris does not own a stove, oven, or microwave , because revenge is a dish best served cold.|3.81|32|
Chuck Norris favorite color is Chuck Norris.|3.81|32|
Chuck Norris' action figure has been pulled out of the market in 36 countries because it is considered a blunt weapon, not a toy.|3.81|32|
The reason the apple logo has a bite in it is because Chuck Norris was hungry.|3.81|31|
When Chuck Norris drinks beer, the beer gets drunk.|3.81|31|
Chuck Norris never takes showers; filth is too afraid to stick to him.|3.81|27|
Even Chuck Norris' enemies list him as their emergency contact.|3.81|27|
Hellen Keller's favorite color is Chuck Norris.|3.81|26|
In 1992 Chuck Norris was in a chili eating contest. Hurricane Andrews soon followed.|3.81|26|
Chuck Norris scared the Swine Flu out of pigs, that is the reason it now is infecting humans.|3.81|26|
Chuck Norris can do the monkey bars with one hand behind his back.|3.81|26|
Real men eat honey for breakfast CHUCK NORRIS chews bees.|3.81|26|
Chuck Norris can literally fart napalm.|3.81|26|
Chuck Norris can win a old fashion gun duel with out turning around.|3.81|26|
Chuck Norris can stain stainless steel.|3.81|21|
"In the dictionary, there is a picture of Chuck Norris wearing a bulletproof vest next to the word ""redundant""."|3.81|21|
When Chuck Norris was seven, he had a paper route job. There was no survivors.|3.81|21|
Chuck Norris once swallowed a cup of cinnamon. He almost coughed.|3.81|16|
There is not a single funny thing about Chuck Norris, my face learned the hard way.|3.81|16|
The Mayan's predicted that in the year 2012 someone will tell Chuck Norris to kill time.|3.81|16|
Once Chuck Norris bought a lazer pointer. 2 days later he swallowed it. When he crapped it out, it became a lightsaber.|3.81|16|
"Chuck Norris' favourite flavour of icecream is ""Radioactive""."|3.81|16|
Chuck Norris can whistle words.|3.81|16|
The only thing scarier than Chuck Norris is the fact that nothing is scarier than Chuck Norris|3.81|58|
Chuck Norris can walk up an elevator.|3.81|57|
Chuck Norris climbed Mount Everest in 15 minutes, 14 of which he spent building a snowman at the bottom.|3.81|42|
Chuck Norris can swim to Europe.... without getting wet.|3.8|93|
It took the Roman senate around 32 stabs with a knife to kill Caesar. It would take Chuck Norris about two BBs and a spork.|3.8|85|
Chuck Norris can gargle Peanut Butter.|3.8|79|
Chuck Norris has a beard because everytime he tries to shave, his hairs break the blades.|3.8|35|
If Johnny has 3 apples and Chuck Norris has 5 apples and Johnny takes 2 apples from Chuck Norris, how many apples will Chuck Norris have left? None�Chuck will eat 1 while shoving the other 7 up Johnny�s ass.|3.8|35|
Chuck Norris' left hand knows what the right hand is about to do.|3.8|30|
Chuck Norris easily won on 'Iron Chef America' by microwaving 2 ham & cheese Hotpockets. Prior to the show, he advised the judges he would provide them with thier choice of either Hotpockets or a knuckle sandwich.|3.8|30|
Chuck Norris found Waldo without opening the book.|3.8|30|
When there's a fire, you stop, drop, and roll. When there's a Chuck Norris, you stop, drop, and die.|3.8|25|
Chuck Norris doesn't pull his weeds. He pushes them back down where they came from.|3.8|25|
The Mayans predicted the day Chuck Norris loses his temper.|3.8|25|
The easiest and most painful way of suicide is to pick a fight with Chuck Norris.|3.8|20|
When Chuck Norris goes to Rome, the Romans do as Chuck Norris does.|3.8|20|
One Million Persians were defeated by 300 Spartans. One Million Spartans were defeated by Chuck Norris.|3.8|20|
Chuck Norris can make 1 + 1 = 3.|3.8|20|
Moses' beard was Chuck Norris' idea.|3.8|20|
Chuck Norris beat guitar hero using an air guitar.|3.8|15|
Chuck Norris canmix his vinegar and oil.|3.8|10|
Shooting stars are caused by Chuck Norris hitting home runs.|3.8|10|
There is a bridge in Austria named the Chuck Norris Bridge. So far, 256 people have died on it.|3.8|10|
If you work in an office with Chuck Norris, don't ask him for his three-hole-punch.|3.8|10|
Chuck Norris refuses to wash his hands before returning to service.|3.8|10|
Chuck Norris once completed the London Maraton in 50 mins and for 40 of them he was streching.|3.8|10|
Chuck Norris has an iPhone 19, but says it's too last year.|3.8|10|
When Chuck Norris crosses the street, cars look both ways.|3.8|66|
God invented the world because Chuck Norris needed a punching bag.|3.8|64|
Chuck Norris doesn't bring sexy back. It's delivered to him on a silver platter.|3.8|54|
"Chuck Norris tried suing the makers of bubble tape because he thought ""6 feet of fun"" was something women referred to as his wiener."|3.79|82|
Chuck Norris� toenail clippings are used as currency in 8 countries.|3.79|39|
The temperature of hell is EXACTLY half that of Chuck Norris's sauna.|3.79|39|
Chuck Norris didn't hit puberty, he roundhouse kicked it.|3.79|39|
Most people take steroids to get buff. Chuck Norris has to take Estrogen to keep rom getting any bigger.|3.79|38|
Batman has a Chuck Norris blanket.|3.79|34|
Chuck Norris had a conversation with Hellen Keller.|3.79|33|
Chuck Norris is Lukes real father!|3.79|33|
Chuck Norris can divide by roundhouse kick.|3.79|33|
"When Chuck Norris answers the phone, he just says ""Go"". This is not permission for you to begin speaking, it is your cue to start running for your life."|3.79|33|
The universe is expanding because it's getting too small for Chuck Norris.|3.79|29|
Chuck Norris never recieved any acting awards... He was never acting.|3.79|29|
When Chuck Norris pees, The National Weather Service issues a flash flood warning for every county in the United States.|3.79|28|
When Chuck Norris walks into a church confessional, the priest starts confessing.|3.79|28|
Chuck Norris once rode a bull through a china shop. The only thing that broke was the bull.|3.79|28|
Chuck Norris is so tough, he masturbates with sand paper.|3.79|28|
Chuck Norris is better than UPS because he ALWAYS DELIVERS.|3.79|28|
Chuck Norris can take off his socks without taking off his shoes.|3.79|24|
They tried to carve Chuck Norris's head into Mount Rushmore, but the granite wasn't hard enough for his beard.|3.79|24|
Chuck Norris had a paper route when he was a kid: there were no survivors.|3.79|24|
When Chuck Norris is in Rome, they do what he does.|3.79|24|
For some people times are tough, but for Chuck Norris, he is tough on time.|3.79|24|
You know how some poeple made it down niagra falls in a barrel Chuck Norris made it up in a cardboard box.|3.79|19|
Chuck Norris can make a hole-in-one with a football.|3.79|14|
Chuck Norris can piss into the wind and remain dry.|3.79|14|
Chuck Norris once had sex with the Statue of Liberty, Captain America was born.|3.79|14|
Chuck Norris doesn't think he can dance. He knows.|3.79|14|
Chuck Norris once walked into a sauna. The sauna couldn't take the heat.|3.79|68|
Chuck Norris once broke a persons arm by kicking them in the leg.|3.79|67|
Chuck Norris can catch a fly with one chopstick.|3.79|66|
When somebody shoots Chuck Norris the bullet gets hurt.|3.79|63|
When Chuck Norris goes hunting he doesn't bring his gun. The animals commit suicide.|3.79|56|
Chuck Norris once performed heart surgery... on his own heart.|3.79|48|
When Chuck Norris plays video games, God mode instantly turns on.|3.79|47|
What Chuck Norris doesn't know, will kill you.|3.78|87|
If Chuck Norris has 10 bananas, and you take away 7, he still has 10.|3.78|37|
Chuck Norris gives Freddy Kruger nightmares.|3.78|36|
All ten of Chuck Norris' fingers are middle fingers.|3.78|36|
Zombies are waiting for the Chuck Norris apocalypse.|3.78|36|
If Chuck Norris is your friend, he will never stab you in the back. Chuck Norris will roundhouse kick you in the face.|3.78|32|
Chuck Norris can solve a Rubik's Cube with one karate chop.|3.78|27|
Jack was nimble, jack was quick, but jack couldn't dodge Chuck Norris' roundhouse kick.|3.78|27|
Fear itself fears Chuck Norris.|3.78|27|
Chuck Norris made a world record in Pole Vaulting without using a pole. |3.78|23|
It was once said that Chuck Norris killed an Alskan grizzly bear with his bare hands, and then brought it back to life.|3.78|23|
Chuck Norris once killed 100 men with nothing but half a staple held with his front teeth.|3.78|18|
Chuck Norris once stepped on a mine... He then proceeded to buy new shoes.|3.78|18|
People set farts on fire. Chuck Norris' farts set people on fire.|3.78|18|
Chuck Norris can pull handbrake turns in a boat.|3.78|9|
Chuck Norris uses dry ice in all of his drinks.|3.78|68|
Chuck Norris doesn't stub his toes. He accidentally destroys chairs, bedframes, and sidewalks.|3.78|60|
Every morning Chuck Norris eats a vitamin shake made from nails and bolts. In the evening, he craps out a toolbox.|3.78|51|
A Chuck Norris action figure has slept with more women than you.|3.78|51|
On myspace Chuck Norris has more friends than Tom.|3.78|50|
